,id,title,description,publishedAt,channelTitle,channelId,categoryId,tags,viewCount,likeCount,dislikeCount,commentCount,favoriteCount,channelViewCount,subscriberCount,hiddenSubscriberCount,videoCount,channelPublishedAt,customUrl,channelDescription,last_50_videos,rank,dataTakenAt
1,kInnbKht5bA,Das Hochwasser und seine Folgen im Westen Deutschlands I ZDF spezial,"Das extreme Hochwasser im Westen Deutschlands hat mehrere Todesopfer gefordert, viele Menschen werden noch vermisst. Häuser stürzen ein, Anwohner*innen retten sich auf Dächer. Das ZDF spezial mit Berichten aus den betroffenen Gebieten und Einordnungen zu Wetterlage und Klimawandel.

In Rheinland-Pfalz und Nordrhein-Westfalen zeigt sich ein Bild der Verwüstung. Anwohner*innen berichten von der Wucht der gefährlichen Fluten und wie schnell sie selbst in Gefahr gerieten, als sie anderen helfen wollten. 

In NRW sind 24 Menschen ums Leben gekommen, etliche werden noch vermisst. In dem Bundesland fielen teilweise mehr als 150 Liter Regen pro Quadratmeter. Manche Pegel sinken wieder, doch die Betroffenen müssen erst noch realisieren, was wirklich geschehen ist: „Die Bilder kann man nicht vergessen. Ich glaube, da braucht man auch viele Jahre, um das alles zu verdauen“, erzählt Milad Eshafae aus Stolberg. 

In Rheinland-Pfalz trifft es vor allem den Raum Trier und die Eifel. Allein im Kreis Ahrweiler sind bislang 18 Menschen gestorben. 

In der Region ist man Hochwasser zwar gewohnt, aber diese Ausmaße haben Anwohner*innen noch nicht erlebt: „Ganz, ganz schlimm. Hochwasser hatten wir schon öfters, aber nicht so brutal“, so Theo Klein. 

Francesco Collura, Anwohner in Altena, berichtet: „Da, wo Straßen und Bürgersteige waren, ist einfach nichts mehr. Autos wurden wie Spielzeuge weggespült.“
Viele Menschen müssen direkt von den Dächern ihrer Häuser mit dem Hubschrauber geretten werden. 

Wie geht das Wetter weiter und wie ist diese Wetterlage einzuschätzen? ZDF-Wetterexpertin Katja Horneffer klärt auf. Und Volker Angres, Leiter der ZDF-Umweltredaktion, ordnet diese Geschehen in die Klima-Debatte ein. 

-----
Hier auf ZDFheute Nachrichten erfahrt ihr, was auf der Welt passiert und was uns alle etwas angeht: Wir sorgen für Durchblick in der Nachrichtenwelt, erklären die Hintergründe und gehen auf gesellschaftliche Debatten ein. Diskutiert in Livestreams mit uns und bildet euch eure eigene Meinung mit den Fakten, die wir euch präsentieren. 

Abonniert unseren Kanal, um nichts mehr zu verpassen. 

Immer auf dem aktuellen Stand seid ihr auf https://www.heute.de 

#Hochwasser #Extremwetter #ZDFspezial",2021-07-15 19:49:35+00:00,ZDFheute Nachrichten,UCeqKIgPQfNInOswGRWt48kQ,25,"['ZDF', 'hochwasser', 'nrw', 'rlp', 'hochwasser nrw', 'hochwasser rlp', 'rheinland-pfalt', 'nordrhein-westfalen', 'armin laschet', 'malu dreyer', 'extremwetter', 'klimawandel', 'stolberg', 'trier', 'eifel', 'altena', 'ahrweiler', 'feuerwehr', 'hochwasser 2021', 'hagen', 'nachrichten', 'zdf nachrichten', 'zdf heute nachrichten', 'zdf heute', 'aktuell']",456344,3681,381,2418,0,197421097,410000,False,2540,2019-08-05 12:42:10+00:00,zdfheute,"Willkommen auf dem offiziellen ZDFheute Nachrichten YouTube-Kanal. 

Hier erfahrt ihr, was auf der Welt passiert und was uns alle etwas angeht: Wir sorgen für Durchblick in der Nachrichtenwelt, erklären die Hintergründe und ordnen aktuelle Meldungen ein.","[{'viewCount': '150', 'likeCount': '10', 'dislikeCount': '2', 'favoriteCount': '0', 'commentCount': '11', 'id': 'e6vkgqI6S7A'}]",1,2021-07-17 00:00:04.914483
2,4O7d3_oF9nY,Wie verheerend ist das Hochwasser in Westdeutschland? | DW Nachrichten,"In den Hochwassergebieten werden immer noch Menschen vermisst. Wegen des teilweise lahmgelegten Mobilfunknetzes ist unklar, wie viele von ihnen sich retten konnten. Die Zahl der Toten liegt aktuell bei 81. Die Behörden rechnen aber mit noch weiter steigenden Zahlen. Grund für die schwerste Unwetterkatastrophe in Deutschland seit Jahrzehnten ist ein Tiefdruckgebiet, das seit Tagen über dem Westen Deutschlands festhängt.

Neben der Region Ahrweiler im Norden von Rheinland-Pfalz ist auch die Region rund um das nordrhein-westfälischen Erftstadt südlich von Köln besonders betroffen. Auch dort stürzten mehrere Häuser ein.  Sie wurden unterspült und brachen ein. Nach Angaben der Kölner Bezirksregierung gebe es in der Region immer wieder Notrufe, da Personen trotz Warnung zurück ins Schadensgebiet gekehrt seien oder es nicht verlassen hätten.

DW Deutsch Abonnieren: http://www.youtube.com/user/deutschewelle?sub_confirmation=1
Mehr Nachrichten unter: https://www.dw.com/de/
DW in den Sozialen Medien:
►Facebook: https://www.facebook.com/deutschewellenews/
►Twitter: https://twitter.com/dwnews
►Instagram: https://www.instagram.com/dwnews/
#Hochwasser #Unwetter #Hochwasserkatastrophe",2021-07-16 06:40:02+00:00,DW Deutsch,UCMIgOXM2JEQ2Pv2d0_PVfcg,25,"['hochwasser', 'unwetter', 'ahrweiler', 'deutschland', 'laschet', 'hochwasser nrw']",98413,699,81,573,0,312966034,638000,False,27986,2006-10-01 01:14:11+00:00,dwdeutsch,"Die Deutsche Welle (DW) ist Deutschlands internationaler Sender und eine weltweit geschätzte Quelle für verlässliche Nachrichten und Informationen. DW (Deutsch) ist Ihr direkter Draht nach Deutschland und Europa mit 24 Stunden Programm in deutscher Sprache. Sehen Sie Magazine und Reportagen aus Politik und Wirtschaft, Forschung und Wissenschaft, Kunst und Kultur. DW (Deutsch) bringt Ihnen erstklassiges Programm. Made in Germany. Made for Minds.

Bitte beachten Sie die Regeln unserer DW-Netiquette. Die Redaktion behält sich das Recht vor, Kommentare zu prüfen und zu kürzen. Kommentare, die gegen unsere journalistischen Grundsätze verstoßen, werden gelöscht und gegebenenfalls gemeldet. Wir behalten uns außerdem vor, User, die sich wiederholt nicht an unsere Regeln halten, zu blockieren. http://www.dw.com/de/netiquette-einladung-zum-dialog/a-5336159","[{'viewCount': '16859', 'likeCount': '828', 'dislikeCount': '85', 'favoriteCount': '0', 'commentCount': '409', 'id': 'DdzC2qd-ez0'}, {'viewCount': '10844', 'likeCount': '235', 'dislikeCount': '32', 'favoriteCount': '0', 'commentCount': '362', 'id': '2LKK2N1O4zU'}, {'viewCount': '5513', 'likeCount': '139', 'dislikeCount': '58', 'favoriteCount': '0', 'commentCount': '102', 'id': 'cDYUVrggFoE'}, {'viewCount': '98413', 'likeCount': '699', 'dislikeCount': '81', 'favoriteCount': '0', 'commentCount': '573', 'id': '4O7d3_oF9nY'}, {'viewCount': '10270', 'likeCount': '320', 'dislikeCount': '22', 'favoriteCount': '0', 'commentCount': '272', 'id': '1rW5jvQJqH4'}, {'viewCount': '10528', 'likeCount': '198', 'dislikeCount': '130', 'favoriteCount': '0', 'commentCount': '251', 'id': 'xvNyDjBTyio'}, {'viewCount': '11911', 'likeCount': '152', 'dislikeCount': '412', 'favoriteCount': '0', 'commentCount': '396', 'id': 'FPsfQXnPRFE'}, {'viewCount': '1311', 'likeCount': '29', 'dislikeCount': '6', 'favoriteCount': '0', 'commentCount': '7', 'id': 'Dyyw4Z3X8SM'}, {'viewCount': '15920', 'likeCount': '169', 'dislikeCount': '23', 'favoriteCount': '0', 'commentCount': '164', 'id': 'zBvIGyfPoMY'}, {'viewCount': '11304', 'likeCount': '254', 'dislikeCount': '203', 'favoriteCount': '0', 'commentCount': '270', 'id': 'PMKa19WKaTY'}, {'viewCount': '118498', 'likeCount': '735', 'dislikeCount': '2983', 'favoriteCount': '0', 'id': 'bKdb56ZKmdI'}, {'viewCount': '7238', 'likeCount': '84', 'dislikeCount': '209', 'favoriteCount': '0', 'commentCount': '349', 'id': '9GlbqTwVKA8'}, {'viewCount': '4741', 'likeCount': '88', 'dislikeCount': '24', 'favoriteCount': '0', 'commentCount': '108', 'id': '_l3F1jsBlKY'}, {'viewCount': '29687', 'likeCount': '577', 'dislikeCount': '158', 'favoriteCount': '0', 'commentCount': '833', 'id': 'ArH4f6PBQZ4'}, {'viewCount': '53585', 'likeCount': '338', 'dislikeCount': '1235', 'favoriteCount': '0', 'commentCount': '21', 'id': 'nArxlEyKiWQ'}, {'viewCount': '1616', 'likeCount': '70', 'dislikeCount': '12', 'favoriteCount': '0', 'commentCount': '26', 'id': 'g2bOnpA-jpI'}, {'viewCount': '14290', 'likeCount': '439', 'dislikeCount': '37', 'favoriteCount': '0', 'commentCount': '281', 'id': '0GcYGcRnexE'}, {'viewCount': '37921', 'likeCount': '1100', 'dislikeCount': '1455', 'favoriteCount': '0', 'commentCount': '1459', 'id': 'vmBwWyWE2AI'}, {'viewCount': '10326', 'likeCount': '170', 'dislikeCount': '27', 'favoriteCount': '0', 'commentCount': '201', 'id': 'I-BZu5_fpKI'}, {'viewCount': '3345', 'likeCount': '35', 'dislikeCount': '8', 'favoriteCount': '0', 'commentCount': '13', 'id': '7UfRUp6UClc'}, {'viewCount': '28143', 'likeCount': '430', 'dislikeCount': '277', 'favoriteCount': '0', 'commentCount': '302', 'id': 'O2K5CEKX_nw'}, {'viewCount': '19816', 'likeCount': '193', 'dislikeCount': '49', 'favoriteCount': '0', 'commentCount': '71', 'id': 'vN8ykAHJtq8'}, {'viewCount': '12352', 'likeCount': '211', 'dislikeCount': '25', 'favoriteCount': '0', 'commentCount': '47', 'id': '7Acl4HVZNOc'}, {'viewCount': '7520', 'likeCount': '101', 'dislikeCount': '16', 'favoriteCount': '0', 'commentCount': '29', 'id': 'G0_raT3Toog'}, {'viewCount': '4427', 'likeCount': '151', 'dislikeCount': '80', 'favoriteCount': '0', 'id': '1Zxo5EkC5Pc'}, {'viewCount': '7119', 'likeCount': '187', 'dislikeCount': '75', 'favoriteCount': '0', 'commentCount': '495', 'id': 'nWpcSAX6FDo'}, {'viewCount': '66289', 'likeCount': '693', 'dislikeCount': '128', 'favoriteCount': '0', 'id': 'Mp7wuSxwUPg'}, {'viewCount': '28850', 'likeCount': '289', 'dislikeCount': '58', 'favoriteCount': '0', 'commentCount': '259', 'id': '5uhDfm8eFjY'}, {'viewCount': '2973', 'likeCount': '63', 'dislikeCount': '12', 'favoriteCount': '0', 'commentCount': '47', 'id': 'AFMbVUCR1cs'}, {'viewCount': '51025', 'likeCount': '627', 'dislikeCount': '224', 'favoriteCount': '0', 'commentCount': '384', 'id': 'W1Y6PPtuJuk'}, {'viewCount': '24444', 'likeCount': '382', 'dislikeCount': '13', 'favoriteCount': '0', 'commentCount': '85', 'id': 'eitxC846FHY'}, {'viewCount': '25801', 'likeCount': '407', 'dislikeCount': '120', 'favoriteCount': '0', 'id': 'jBI-dTcIWBU'}, {'viewCount': '80966', 'likeCount': '867', 'dislikeCount': '639', 'favoriteCount': '0', 'id': 'Vhwy6u5rz5I'}, {'viewCount': '16207', 'likeCount': '201', 'dislikeCount': '38', 'favoriteCount': '0', 'commentCount': '140', 'id': 'DhRmJYFKz1I'}, {'viewCount': '426861', 'likeCount': '3112', 'dislikeCount': '989', 'favoriteCount': '0', 'commentCount': '3596', 'id': '341sIu_ZiOs'}, {'viewCount': '36763', 'likeCount': '542', 'dislikeCount': '56', 'favoriteCount': '0', 'commentCount': '307', 'id': 'shaVo7EaLcQ'}, {'viewCount': '45967', 'likeCount': '256', 'dislikeCount': '798', 'favoriteCount': '0', 'commentCount': '456', 'id': 'U2Wxh7HooN8'}, {'viewCount': '68980', 'likeCount': '1039', 'dislikeCount': '83', 'favoriteCount': '0', 'commentCount': '328', 'id': 'o03Jp8CFlLk'}, {'viewCount': '17538', 'likeCount': '255', 'dislikeCount': '22', 'favoriteCount': '0', 'commentCount': '138', 'id': 'rKgizJEElQE'}, {'viewCount': '382756', 'likeCount': '4612', 'dislikeCount': '245', 'favoriteCount': '0', 'commentCount': '1840', 'id': 'mSgl7T9lUJo'}, {'viewCount': '6133', 'likeCount': '106', 'dislikeCount': '15', 'favoriteCount': '0', 'commentCount': '27', 'id': '-M7iponuijY'}, {'viewCount': '7147', 'likeCount': '117', 'dislikeCount': '7', 'favoriteCount': '0', 'commentCount': '38', 'id': 'fvmv6THGm-U'}, {'viewCount': '47067', 'likeCount': '558', 'dislikeCount': '129', 'favoriteCount': '0', 'commentCount': '561', 'id': '_vB9T6FLVPw'}, {'viewCount': '72784', 'likeCount': '714', 'dislikeCount': '1753', 'favoriteCount': '0', 'id': '1rCLWf4tdGI'}, {'viewCount': '4610', 'likeCount': '125', 'dislikeCount': '9', 'favoriteCount': '0', 'commentCount': '31', 'id': 'mT4gIkpsTF0'}, {'viewCount': '15144', 'likeCount': '143', 'dislikeCount': '64', 'favoriteCount': '0', 'id': 'sMebulSj_3E'}, {'viewCount': '318094', 'likeCount': '3898', 'dislikeCount': '854', 'favoriteCount': '0', 'commentCount': '3011', 'id': 'dN1CJwC5KiY'}, {'viewCount': '20063', 'likeCount': '457', 'dislikeCount': '338', 'favoriteCount': '0', 'commentCount': '610', 'id': '6b1m6aoKHBk'}, {'viewCount': '33224', 'likeCount': '502', 'dislikeCount': '142', 'favoriteCount': '0', 'commentCount': '414', 'id': 'gXyUmajNvPc'}, {'viewCount': '24040', 'likeCount': '293', 'dislikeCount': '32', 'favoriteCount': '0', 'commentCount': '209', 'id': 'zkWB3SnHILM'}]",2,2021-07-17 00:00:04.914483
3,SiCxHLaTH8Q,Zukunft,"Provided to YouTube by Believe SAS

Zukunft · RAF Camora · RAF Camora · The Cratez · The Royals · RAF Camora · RAF Camora · The Cratez · The Royals

Zukunft

℗ Indipendenza under exclusive license to Groove Attack

Released on: 2021-07-16

Auto-generated by YouTube.",2021-07-15 21:05:37+00:00,RAF Camora - Topic,UCZHCkx-08zBqSD1A1C5TWrA,10,"['RAF Camora', 'The Cratez', 'The Royals', 'Zukunft']",253516,17430,400,0,0,72842585,19500,False,406,2013-12-21 01:01:06+00:00,,"Raphael Ragucci, known professionally as RAF Camora, colloquially referred to as RAF, is an Austrian rapper.","[{'viewCount': '59545', 'likeCount': '3712', 'dislikeCount': '28', 'favoriteCount': '0', 'commentCount': '0', 'id': 'o_cOu0jx-x4'}, {'viewCount': '56116', 'likeCount': '2820', 'dislikeCount': '16', 'favoriteCount': '0', 'commentCount': '0', 'id': 'p_jf5gw_xmM'}, {'viewCount': '48296', 'likeCount': '1825', 'dislikeCount': '11', 'favoriteCount': '0', 'commentCount': '0', 'id': 'nuHsvQnnXFw'}, {'viewCount': '64374', 'likeCount': '3156', 'dislikeCount': '36', 'favoriteCount': '0', 'commentCount': '0', 'id': 'ok_LiwouOpk'}, {'viewCount': '74256', 'likeCount': '3545', 'dislikeCount': '35', 'favoriteCount': '0', 'commentCount': '0', 'id': '5TD8rQsGjPU'}, {'viewCount': '67886', 'likeCount': '3347', 'dislikeCount': '24', 'favoriteCount': '0', 'commentCount': '0', 'id': 'vSa40MgUzSk'}, {'viewCount': '253516', 'likeCount': '17435', 'dislikeCount': '401', 'favoriteCount': '0', 'commentCount': '0', 'id': 'SiCxHLaTH8Q'}, {'viewCount': '60017', 'likeCount': '3386', 'dislikeCount': '28', 'favoriteCount': '0', 'commentCount': '0', 'id': 'vrQFus3bwP4'}, {'viewCount': '52652', 'likeCount': '2858', 'dislikeCount': '20', 'favoriteCount': '0', 'commentCount': '0', 'id': 'v7_P1McVqfU'}, {'viewCount': '48169', 'likeCount': '2326', 'dislikeCount': '16', 'favoriteCount': '0', 'commentCount': '0', 'id': 'Kds7Dmyv-Ik'}, {'viewCount': '100162', 'likeCount': '5092', 'dislikeCount': '44', 'favoriteCount': '0', 'commentCount': '0', 'id': 'gVcwghcvDc8'}, {'viewCount': '87174', 'likeCount': '5259', 'dislikeCount': '52', 'favoriteCount': '0', 'commentCount': '0', 'id': 'Baezcx-W95w'}, {'viewCount': '51721', 'likeCount': '2388', 'dislikeCount': '15', 'favoriteCount': '0', 'commentCount': '0', 'id': 'Vnrct3ZmMuE'}, {'viewCount': '49938', 'likeCount': '2230', 'dislikeCount': '19', 'favoriteCount': '0', 'commentCount': '0', 'id': 'Y9Zg4ycx0z8'}, {'viewCount': '4798', 'likeCount': '244', 'dislikeCount': '2', 'favoriteCount': '0', 'commentCount': '0', 'id': 'nPSm5ZvPRlU'}, {'viewCount': '2340', 'likeCount': '93', 'dislikeCount': '1', 'favoriteCount': '0', 'commentCount': '1', 'id': 'rzkslWCZgCs'}, {'viewCount': '1679', 'likeCount': '51', 'dislikeCount': '1', 'favoriteCount': '0', 'commentCount': '0', 'id': '_vEEMXtHgP0'}, {'viewCount': '1417', 'likeCount': '39', 'dislikeCount': '1', 'favoriteCount': '0', 'commentCount': '3', 'id': '02ZfXYPoE80'}, {'viewCount': '3772', 'likeCount': '136', 'dislikeCount': '1', 'favoriteCount': '0', 'commentCount': '19', 'id': 'HeS8jRjJJRk'}, {'viewCount': '4075', 'likeCount': '73', 'dislikeCount': '2', 'favoriteCount': '0', 'commentCount': '6', 'id': 'O1VNEWUpZE0'}, {'viewCount': '4550', 'likeCount': '57', 'dislikeCount': '3', 'favoriteCount': '0', 'commentCount': '4', 'id': '_4VzfCBOQes'}, {'viewCount': '1559', 'likeCount': '48', 'dislikeCount': '1', 'favoriteCount': '0', 'commentCount': '6', 'id': 'hSFAhgPk3Cc'}, {'viewCount': '1051', 'likeCount': '35', 'dislikeCount': '3', 'favoriteCount': '0', 'commentCount': '3', 'id': 'jnnV2i4SRYg'}, {'viewCount': '2579', 'likeCount': '43', 'dislikeCount': '0', 'favoriteCount': '0', 'commentCount': '0', 'id': '1JN5DU4sOV8'}, {'viewCount': '2573', 'likeCount': '65', 'dislikeCount': '0', 'favoriteCount': '0', 'commentCount': '0', 'id': '5s2FAgvtqGY'}, {'viewCount': '954', 'likeCount': '28', 'dislikeCount': '2', 'favoriteCount': '0', 'commentCount': '0', 'id': '5u6CMSKDXjA'}, {'viewCount': '304', 'likeCount': '6', 'dislikeCount': '0', 'favoriteCount': '0', 'commentCount': '0', 'id': 'AQrAErG9m1o'}, {'viewCount': '1593', 'likeCount': '45', 'dislikeCount': '2', 'favoriteCount': '0', 'commentCount': '2', 'id': 'FB1ZN0lyMhE'}, {'viewCount': '1150', 'likeCount': '18', 'dislikeCount': '0', 'favoriteCount': '0', 'commentCount': '1', 'id': 'L4jvJukKgaY'}, {'viewCount': '1591', 'likeCount': '25', 'dislikeCount': '4', 'favoriteCount': '0', 'commentCount': '4', 'id': 'LEXdHM96QK0'}, {'viewCount': '220', 'likeCount': '8', 'dislikeCount': '0', 'favoriteCount': '0', 'commentCount': '0', 'id': 'M-DS1l-0kkM'}, {'viewCount': '746', 'likeCount': '9', 'dislikeCount': '2', 'favoriteCount': '0', 'commentCount': '0', 'id': 'avbPlPe-rAM'}, {'viewCount': '1199', 'likeCount': '22', 'dislikeCount': '1', 'favoriteCount': '0', 'commentCount': '1', 'id': 'dkxuLgWIhzc'}, {'viewCount': '3357', 'likeCount': '44', 'dislikeCount': '2', 'favoriteCount': '0', 'commentCount': '1', 'id': 'pL4X4CZr2-c'}, {'viewCount': '2156', 'likeCount': '36', 'dislikeCount': '1', 'favoriteCount': '0', 'commentCount': '1', 'id': 'sZ0p98hp79Y'}, {'viewCount': '1096', 'likeCount': '38', 'dislikeCount': '0', 'favoriteCount': '0', 'commentCount': '7', 'id': 'U88KUmZk12A'}, {'viewCount': '639', 'likeCount': '18', 'dislikeCount': '0', 'favoriteCount': '0', 'commentCount': '1', 'id': 'g71CIDaTZY0'}, {'viewCount': '1730', 'likeCount': '16', 'dislikeCount': '1', 'favoriteCount': '0', 'commentCount': '0', 'id': 'zWJuDMM6x58'}, {'viewCount': '323', 'likeCount': '9', 'dislikeCount': '0', 'favoriteCount': '0', 'commentCount': '2', 'id': '24zfIwOgTQg'}, {'viewCount': '957', 'likeCount': '16', 'dislikeCount': '0', 'favoriteCount': '0', 'commentCount': '0', 'id': '9Zu70I8i6pw'}, {'viewCount': '439', 'likeCount': '14', 'dislikeCount': '0', 'favoriteCount': '0', 'commentCount': '1', 'id': 'ACFlv_aKhyw'}, {'viewCount': '430', 'likeCount': '12', 'dislikeCount': '0', 'favoriteCount': '0', 'commentCount': '0', 'id': 'LymctEBTlWY'}, {'viewCount': '1463', 'likeCount': '29', 'dislikeCount': '0', 'favoriteCount': '0', 'commentCount': '1', 'id': 'SWoqXfTbn7Q'}, {'viewCount': '951', 'likeCount': '23', 'dislikeCount': '0', 'favoriteCount': '0', 'commentCount': '1', 'id': 'XOWy6zBAAOY'}, {'viewCount': '394', 'likeCount': '9', 'dislikeCount': '0', 'favoriteCount': '0', 'commentCount': '0', 'id': 'ncxDCknG_EU'}, {'viewCount': '291', 'likeCount': '7', 'dislikeCount': '0', 'favoriteCount': '0', 'commentCount': '0', 'id': 'niPBx9RF5KA'}, {'viewCount': '182', 'likeCount': '7', 'dislikeCount': '0', 'favoriteCount': '0', 'commentCount': '0', 'id': 'stvMxl3Z--U'}, {'viewCount': '848', 'likeCount': '18', 'dislikeCount': '3', 'favoriteCount': '0', 'commentCount': '1', 'id': 'x6wIJ1XHu20'}, {'viewCount': '260', 'likeCount': '5', 'dislikeCount': '0', 'favoriteCount': '0', 'commentCount': '0', 'id': 'znX1UI9IzWk'}, {'viewCount': '1161', 'likeCount': '14', 'dislikeCount': '0', 'favoriteCount': '0', 'commentCount': '0', 'id': '05TWVxhYQEI'}]",3,2021-07-17 00:00:04.914483
